"Address","Occurrences","H2-1","H2-1 Length","H2-2","H2-2 Length","Indexability","Indexability Status"
"https://nmgtechnologies.com/solution/fintech/","13","Empower the Financial Ecosystem with fintech Software Development Services","74","Our Full-Stack Custom Fintech Software Development Services.","60","Indexable",""
"https://nmgtechnologies.com/blog/working-from-home-during-the-coronavirus-lockdown","6","Background about CoronaVirus and Government of Delhi and Haryana mandate to private companies","93","Preemptive steps taken by NMG to prepare for Work From Home","59","Indexable",""
"https://nmgtechnologies.com/ai-strategy-implementation-consulting","12","From Ideas to Execution - Building a Clear AI Roadmap for Your Business","71","Why AI Strategy Consulting is Essential","39","Indexable",""
"https://nmgtechnologies.com/download-appdevelopmentcost-ebook","1","How Much Will It Cost To Build My App? Here are 6 Rules To Help You Plan Your Budgets","85","","0","Indexable",""
"https://nmgtechnologies.com/blog/wordpress-website-perfect-solution-small-business","11","Since the time WordPress was first launched, it has been one of the most preferred tools for content management system globally. even when there are many other choices a business can choose from but the ultimate choice would be WordPress.","238","Since the time WordPress was first launched, it has been one of the most preferred tools for the content management system globally. Even when there are many other choices a business can choose from, the ultimate choice would be WordPress Website.","247","Indexable",""
"https://nmgtechnologies.com/success-stories/atlys-case-study","2","How Atlys Gained Over 100K+ Mobile App Downloads & 334K Organic Clicks with NMG's Software Development, SEO, App Store Optimization & Link-Building Strategies","158","","0","Indexable",""
