"Address","Occurrences","Title 1","Title 1 Length","Title 1 Pixel Width","Indexability","Indexability Status"
"https://nmgtechnologies.com/blog/nmg-technologies-to-participate-in-mobile-word-capital-barcelona-the-worlds-largest-and-most-influential-connectivity-event","1","NMG Technologies to Participate in Mobile Word Capital Barcelona – the world’s largest and most influential connectivity event","126","1121","Indexable",""
"https://nmgtechnologies.com/services/dedicated-team-setups/","1","Dedicated Team Setups","21","211","Indexable",""
"https://nmgtechnologies.com/blog/nmg-to-participate-in-the-largest-tech-expo-in-the-middle-east-gitex-global-2023-dubai","1","NMG to Participate in the Largest Tech Expo in the Middle East - GITEX Global 2023, Dubai","89","794","Indexable",""
"https://nmgtechnologies.com/blog/nmg-technologies-participated-in-softwave-2023-the-republic-of-korea-software-exhibition","1","NMG Technologies Participated in Softwave 2023, The Republic of Korea Software Exhibition","89","819","Indexable",""
"https://nmgtechnologies.com/services/crm-development","1","CRM Development Services","24","242","Indexable",""
"https://nmgtechnologies.com/blog/stay-ahead-of-the-game-with-koora-break-your-ultimate-companion-for-football-updates","1","Never Miss a Goal with Koora Break!","35","322","Indexable",""
"https://nmgtechnologies.com/blog/nmg-to-participate-in-the-largest-tech-expo-in-the-middle-east-gitex-global-2022-dubai","1","NMG to Participate in the Largest Tech Expo in the Middle East - GITEX Global 2022, Dubai","89","794","Indexable",""
"https://nmgtechnologies.com/blog/nmg-technologies-to-participate-in-retail-innovation-conference-and-expo-2023-in-chicago","1","NMG Technologies to Participate in Retail Innovation Conference and Expo 2023 in Chicago","88","807","Indexable",""
"https://nmgtechnologies.com/blog/nmg-technologies-to-sponsor-and-exhibit-at-brighton-seo-2023-and-online-pr-show-2023","1","NMG Technologies to Sponsor and Exhibit at Brighton SEO 2023 and Online PR Show 2023","84","799","Indexable",""
"https://nmgtechnologies.com/blog/nmg-technologies-to-participate-in-leap-2023-tech-conference-in-riyadh-saudi-arabia","1","NMG Technologies to Participate in LEAP 2023 Tech Conference in Riyadh, Saudi Arabia","84","778","Indexable",""
